{
  "$schema": "https://json-schema.org/draft/2020-12/schema",
  "title": "AHAS V1 supplied snapshot manifest",
  "type": "object",
  "additionalProperties": false,
  "required": [
    "schema_version",
    "snapshot_id",
    "account_id",
    "source_category",
    "text_format",
    "default_language",
    "coverage"
  ],
  "properties": {
    "schema_version": {
      "const": "1.0.0"
    },
    "snapshot_id": {
      "type": "string",
      "minLength": 1,
      "maxLength": 256
    },
    "account_id": {
      "type": "string",
      "minLength": 1,
      "maxLength": 256
    },
    "source_category": {
      "enum": [
        "synthetic",
        "user_supplied",
        "research_corpus"
      ]
    },
    "capture_utc": {
      "type": [
        "string",
        "null"
      ],
      "pattern": "^\\d{4}-\\d{2}-\\d{2}T\\d{2}:\\d{2}:\\d{2}(?:\\.\\d{1,6})?Z$",
      "format": "date-time",
      "default": null
    },
    "text_format": {
      "enum": [
        "plain",
        "markdown"
      ]
    },
    "default_language": {
      "type": "string",
      "pattern": "^[a-z]{2,3}(?:-[A-Za-z0-9]{2,8})*$"
    },
    "source_notes": {
      "type": "string",
      "default": ""
    },
    "license_notes": {
      "type": [
        "string",
        "null"
      ],
      "default": null
    },
    "coverage": {
      "type": "object",
      "additionalProperties": false,
      "required": [
        "status"
      ],
      "properties": {
        "status": {
          "enum": [
            "unknown",
            "sampled",
            "complete_for_declared_scope"
          ]
        },
        "start_utc": {
          "type": [
            "string",
            "null"
          ],
          "pattern": "^\\d{4}-\\d{2}-\\d{2}T\\d{2}:\\d{2}:\\d{2}(?:\\.\\d{1,6})?Z$",
          "format": "date-time",
          "default": null
        },
        "end_utc": {
          "type": [
            "string",
            "null"
          ],
          "pattern": "^\\d{4}-\\d{2}-\\d{2}T\\d{2}:\\d{2}:\\d{2}(?:\\.\\d{1,6})?Z$",
          "format": "date-time",
          "default": null
        },
        "known_gaps": {
          "type": "array",
          "items": {
            "type": "object",
            "additionalProperties": false,
            "required": [
              "start_utc",
              "end_utc"
            ],
            "properties": {
              "start_utc": {
                "type": "string",
                "pattern": "^\\d{4}-\\d{2}-\\d{2}T\\d{2}:\\d{2}:\\d{2}(?:\\.\\d{1,6})?Z$",
                "format": "date-time"
              },
              "end_utc": {
                "type": "string",
                "pattern": "^\\d{4}-\\d{2}-\\d{2}T\\d{2}:\\d{2}:\\d{2}(?:\\.\\d{1,6})?Z$",
                "format": "date-time"
              },
              "note": {
                "type": "string",
                "default": ""
              }
            }
          },
          "default": []
        },
        "notes": {
          "type": "string",
          "default": ""
        }
      }
    }
  }
}
